Unnamed: 0,video-id,fold-ind,startphrase,sent1,sent2,gold-source,ending0,ending1,ending2,ending3,label
2617,dream-0090-triplet-2,0,When does 'have a dinner party' happen?,fake_sent1,When does 'have a dinner party' happen?,gen,fight,around 6:30 or 7:00,Sunday,Saturday,3
3749,dream-0871-triplet-5,0,What is 'go to the University of California' obstructed by?,fake_sent1,What is 'go to the University of California' obstructed by?,gen,"When I went to school, I went to a very small college",I don't think they have a good teaching school,none of my friends from high school are going there,it's so expensive,1
4168,dream-0701-triplet-4,0,What does 'I'm the only child in the family. My mother will be living alone most of the time for three years in my absence.' cause?,fake_sent1,What does 'I'm the only child in the family. My mother will be living alone most of the time for three years in my absence.' cause?,gen,Nobody to take care of her,travels a lot to many countries,My mother will be living alone,the only child in the family,0
3917,dream-0484-triplet-3,0,What does 'real problems in this department' cause?,fake_sent1,What does 'real problems in this department' cause?,gen,look for a new job,leaving us,excellent manager,real problems,0
4179,dream-0703-triplet-2,0,What does 'I always took it with me' cause?,fake_sent1,What does 'I always took it with me' cause?,gen,This picture survived,pictures were destroyed,taken any pictures,sad memories,0
172,daily-dialogue-1095-triplet-1,0,What does 'been late for my meetings' cause?,fake_sent1,What does 'been late for my meetings' cause?,gen,train is delayed,Here it comes now,customers have started to complain,been late for my meetings,2
8,daily-dialogue-1004-triplet-2,0,What is 'jackets' located near?,fake_sent1,What is 'jackets' located near?,gen,try,coats,new jacket,help,1
1511,daily-dialogue-0146-triplet-7,0,When does 'have a better time' happen?,fake_sent1,When does 'have a better time' happen?,gen,go,tour,Beautiful weather,trip,3
1407,daily-dialogue-0111-triplet-2,0,What is 'updated your CV'?,fake_sent1,What is 'updated your CV'?,gen,updated your CV,ready,Nope .,research about the company,1
964,dream-0605-triplet-20,0,What desire is caused by 'free this afternoon'?,fake_sent1,What desire is caused by 'free this afternoon'?,gen,go over and check it out,attend the course in evening,switch a couple of evenings,How is it going,0
3921,dream-0486-triplet-1,0,What does 'at an important meeting' cause?,fake_sent1,What does 'at an important meeting' cause?,gen,can't answer,My name is Li Hong,Good afternoon,sorry,0
3261,dream-0379-triplet-5,0,What is 'stay longer' obstructed by?,fake_sent1,What is 'stay longer' obstructed by?,gen,got a lot of things to see,sit down,lives upstairs,use the public rooms,0
250,daily-dialogue-1165-triplet-4,0,What happens after 'clean my room'?,fake_sent1,What happens after 'clean my room'?,gen,cleaning up your room,clean your room,cleaning my room,I leave,3
3675,dream-0855-triplet-2,0,What is implied by 'look terrible'?,fake_sent1,What is implied by 'look terrible'?,gen,physics grades been posted yet,not very likely you'd suddenly forget everything,passing for the year,I failed it,3
3523,dream-0821-triplet-1,0,What property does 'finding the perfect words' have?,fake_sent1,What property does 'finding the perfect words' have?,gen,the hardest,book,good grass of the writing,try,0
124,daily-dialogue-1066-triplet-2,0,What property does 'Today's movies' have?,fake_sent1,What property does 'Today's movies' have?,gen,make a lot of money,too commercial,I landed on Classic Movies,all-time greats,1
2406,mutual-1122-triplet-1,0,Which goal motivates the act/action 'work at his uncle 's institution'?,fake_sent1,Which goal motivates the act/action 'work at his uncle 's institution'?,gen,for experience,knowing what keeps you from joining your beloved family,not going home,voluntary work,0
2462,mutual-1155-triplet-1,0,What does 'it 's with your families' cause?,fake_sent1,What does 'it 's with your families' cause?,gen,traveling,my family is coming over,you probably do n't want other people there,"no , really .",2
151,daily-dialogue-1082-triplet-4,0,When does 'drink to that' happen?,fake_sent1,When does 'drink to that' happen?,gen,survive the first year,anniversary,night,playing our song,1
429,dream-0191-triplet-3,0,What desire is caused by 'got the runs'?,fake_sent1,What desire is caused by 'got the runs'?,gen,Really,got to go to the restroom quick,my stomach is fine,what should we do now,1
628,dream-0258-triplet-10,0,What is implied by 'the truck hit the taxi'?,fake_sent1,What is implied by 'the truck hit the taxi'?,gen,I was standing outside my house,accident,watch,thanks a lot,1
1238,daily-dialogue-0036-triplet-6,0,What is 'Keep awake' obstructed by?,fake_sent1,What is 'Keep awake' obstructed by?,gen,Lattes are so passe these days,stop bugging Jess,case,try,0
1507,daily-dialogue-0146-triplet-3,0,What does 'on a vacation' cause?,fake_sent1,What does 'on a vacation' cause?,gen,I ’ m on a vacation to see the famous Three Gorges,go,trip to China,trip,3
905,dream-0601-triplet-1,0,What is 'wanted to go' obstructed by?,fake_sent1,What is 'wanted to go' obstructed by?,gen,aunt was in town,wonderful art exhibition,got back from the Art Gallery,inspired by some of the paintings,0
4094,dream-0522-triplet-14,0,What is implied by 'most people will be able to come'?,fake_sent1,What is implied by 'most people will be able to come'?,gen,have the same menu again,35,most people will be able to come,What sort of things would you like,1
748,dream-0561-triplet-2,0,What desire is caused by 'submitted a job application'?,fake_sent1,What desire is caused by 'submitted a job application'?,gen,bring it to my office,anything happened to her,come by your office,asked her in for an interview,3
1233,daily-dialogue-0036-triplet-1,0,What is implied by 'take a hammer to the client's head'?,fake_sent1,What is implied by 'take a hammer to the client's head'?,gen,inspire me to take a hammer to the client's head,get this case worked out in no time,The case is annoying,case is difficult,2
3617,dream-0838-triplet-4,0,What does 'a machine operator' have?,fake_sent1,What does 'a machine operator' have?,gen,a lot more to do,free medical service,worker's welfare,one -hour break,1
914,dream-0601-triplet-10,0,What is 'art exhibition' used for?,fake_sent1,What is 'art exhibition' used for?,gen,worked on that paper,buy anything,give Tom a call,sale,3
3817,dream-0884-triplet-3,0,What property does 'took a dive into the audience' have?,fake_sent1,What property does 'took a dive into the audience' have?,gen,cool,carried to a safe place,amazing,out of control,0
2705,dream-0115-triplet-5,0,What property does 'football game' have?,fake_sent1,What property does 'football game' have?,gen,difficult,played badly,harder,interesting,3
1474,daily-dialogue-0138-triplet-2,0,What is 'credit cards' used for?,fake_sent1,What is 'credit cards' used for?,gen,change,keep you waiting,pay,Thanks,2
2159,mutual-0039-triplet-7,0,What does 'i left it on the table' cause?,fake_sent1,What does 'i left it on the table' cause?,gen,i ca n't find my phone,moved it,buy a dress for my graduation party,it is n't there,3
1232,daily-dialogue-0035-triplet-3,0,What does 'It is a quarter to twelve' cause?,fake_sent1,What does 'It is a quarter to twelve' cause?,gen,we will be late,train is leaving,we will miss our train,the bus is late,2
433,dream-0193-triplet-2,0,What is 'telephone' used for?,fake_sent1,What is 'telephone' used for?,gen,get the news,telephoned me,meeting,"go on Monday, but I couldn't get a ticket for Monday",0
3251,dream-0376-triplet-6,0,What does 'appreciate all your efforts' cause?,fake_sent1,What does 'appreciate all your efforts' cause?,gen,I did.,very good employee,pleased with your work,give you a raise,3
2682,dream-0113-triplet-2,0,What happens after 'get to the station'?,fake_sent1,What happens after 'get to the station'?,gen,See you then,I am.,come and pick you up,call me,3
536,dream-0237-triplet-6,0,What desire is caused by 'He's not moving'?,fake_sent1,What desire is caused by 'He's not moving'?,gen,take him to the hospital,not moving,First Aid Center says they are coming soon,wait until help comes,0
3038,dream-0318-triplet-1,0,Which goal motivates the act/action 'went to Europe'?,fake_sent1,Which goal motivates the act/action 'went to Europe'?,gen,To travel,went to Europe,went to college,Oh.,0
1616,daily-dialogue-0185-triplet-2,0,What prerequisite does 'withdraw some money' have?,fake_sent1,What prerequisite does 'withdraw some money' have?,gen,stating the exact amount you wish to withdraw,money,Fill in the slip,cash,2
2890,dream-0158-triplet-4,0,What property does 'Hong Kong' have?,fake_sent1,What property does 'Hong Kong' have?,gen,major,What about you,great,an international financial center,3
1186,daily-dialogue-0012-triplet-4,0,What happens after 'we'll send you our sample'?,fake_sent1,What happens after 'we'll send you our sample'?,gen,After probation,selling,free samples,we try the sample,3
4196,mutual-0202-triplet-2,0,What is implied by 'been in the library all day'?,fake_sent1,What is implied by 'been in the library all day'?,gen,been in the library all day,right,studying for so long,break,2
3243,dream-0375-triplet-5,0,What desire is caused by 'needs friends'?,fake_sent1,What desire is caused by 'needs friends'?,gen,don't really want to hear it,needs friends,Ok,sends messages to her friends,3
1786,daily-dialogue-1891-triplet-3,0,What prerequisite does 'easy questions' have?,fake_sent1,What prerequisite does 'easy questions' have?,gen,luck of the draw,easy questions,see an action movie,rematch,0
1795,dream-0002-triplet-3,0,What does 'They make a terrible smell' cause?,fake_sent1,What does 'They make a terrible smell' cause?,gen,prefer them to English cigarettes,I don't understand why yousmoke French cigarettes,cigarette,terrible smell,1
3920,dream-0484-triplet-6,0,What does 'upsets Frank' desire?,fake_sent1,What does 'upsets Frank' desire?,gen,what's going on?,time to talk about it,excellent manager,look for a new job,1
2953,dream-0174-triplet-2,0,What does 'do some changes to the house' cause?,fake_sent1,What does 'do some changes to the house' cause?,gen,living room in yellow,wrong,changes to the house,cost a lot of money,3
3326,dream-0418-triplet-1,0,What does 'get pensioned off' cause?,fake_sent1,What does 'get pensioned off' cause?,gen,popular with her age group,looking terribly depressed,bit of a tough character,upset about it,1
1996,dream-0060-triplet-2,0,What does 'I can speak little English' cause?,fake_sent1,What does 'I can speak little English' cause?,gen,speak little English,how I can get to the railway station,I don't understand,English is very good,2
2552,daily-dialogue-3513-triplet-1,0,What is implied by 'have some cereal'?,fake_sent1,What is implied by 'have some cereal'?,gen,hearty breakfast,not time consuming,quick breakfast,don't always have time to make breakfast,3
4107,dream-0526-triplet-8,0,What is 'Two men ran after the robber and held him'?,fake_sent1,What is 'Two men ran after the robber and held him'?,gen,no,help,did you do,passengers,1
3118,dream-0349-triplet-4,0,What desire is caused by 'love snow'?,fake_sent1,What desire is caused by 'love snow'?,gen,"No, not me",go skiing,get cold,go to a hotel in the mountains,1
2494,mutual-1183-triplet-1,0,What does 'comeing prepared class' cause?,fake_sent1,What does 'comeing prepared class' cause?,gen,wondering how to do better,?,improve your grades,web page,2
337,daily-dialogue-1203-triplet-3,0,What is 'ambulance' used for?,fake_sent1,What is 'ambulance' used for?,gen,unhappy,taken to the hospital,heard the news,hurt,1
946,dream-0605-triplet-2,0,What prerequisite does 'major' have?,fake_sent1,What prerequisite does 'major' have?,gen,work in the cafe,ask to change again,Shakespeare course,evening classes,2
1400,daily-dialogue-0108-triplet-2,0,What does 'TV' have?,fake_sent1,What does 'TV' have?,gen,digital TV,digital channels,Korean channels,for what ?,1
2769,dream-0129-triplet-4,0,What property does 'roads' have?,fake_sent1,What property does 'roads' have?,gen,good trip,How long,good,going to the United States,2
1221,daily-dialogue-0029-triplet-1,0,What does 'safe' depend on?,fake_sent1,What does 'safe' depend on?,gen,safe,protect your ear,sound is great,AA batteries,1
670,dream-0263-triplet-13,0,What is an antonym of 'clean up my diet'?,fake_sent1,What is an antonym of 'clean up my diet'?,gen,clean up my diet,eating too much,weight has gone up again,lose weight,1
4162,dream-0700-triplet-1,0,What does 'hands are too cold' cause?,fake_sent1,What does 'hands are too cold' cause?,gen,my favorite,hands are too cold to play well,"played it well, but try to play the second part a little faster",play well,3
2279,mutual-1016-triplet-5,0,What does 'she never pays her rent on time' cause?,fake_sent1,What does 'she never pays her rent on time' cause?,gen,look so worried,she never pays her rent on time,neat and organized,i ca n't put up with her any longer,3
1560,daily-dialogue-0163-triplet-4,0,Where is 'backpack' located?,fake_sent1,Where is 'backpack' located?,gen,Mr .,locker,No .,hardware store,1
4186,dream-0704-triplet-3,0,What does 'it's interesting to see what the weather is like at different times and on different days' cause?,fake_sent1,What does 'it's interesting to see what the weather is like at different times and on different days' cause?,gen,interesting to see what the weather is like,make notes about the different types of weather,it rained heavily,a sunny day,1
3318,dream-0412-triplet-6,0,What desire is caused by 'train is super relaxing'?,fake_sent1,What desire is caused by 'train is super relaxing'?,gen,driving in the city,meeting with friends,neither of us likes it that much,take the train to visit him,3
2969,dream-0178-triplet-4,0,What desire is caused by 'read flora a book'?,fake_sent1,What desire is caused by 'read flora a book'?,gen,so full of energy,sleep a day,takes a short sleep for an hour every six hours,I need at least seven hours,2
123,daily-dialogue-1066-triplet-1,0,Which goal motivates the act/action 'Today's movies'?,fake_sent1,Which goal motivates the act/action 'Today's movies'?,gen,Great,Today's movies are just too commercial,make a lot of money,old movies,2
4181,dream-0703-triplet-4,0,What does 'bomb' cause?,fake_sent1,What does 'bomb' cause?,gen,pictures were destroyed,destroyed our house,sad,My father was killed,1
2024,dream-0064-triplet-7,0,Which goal motivates the act/action 'I come in'?,fake_sent1,Which goal motivates the act/action 'I come in'?,gen,toys for children,saleswoman,Have a scat,looking for a job,3
741,dream-0530-triplet-6,0,What does 'try to copy notes from the board' cause?,fake_sent1,What does 'try to copy notes from the board' cause?,gen,head starts hurting,made an appointment with you,How are you feeling,need glasses,0
3157,dream-0355-triplet-2,0,What does 'went to Joyce's' cause?,fake_sent1,What does 'went to Joyce's' cause?,gen,has to wash the dishes,being late,don't need her,come home,1
2561,daily-dialogue-3515-triplet-3,0,What is implied by 'fight this ticket'?,fake_sent1,What is implied by 'fight this ticket'?,gen,fight this ticket,information isn't true,There was no picture taken,the signal had a camera,1
1127,daily-dialogue-0001-triplet-3,0,What is 'lipstick' used for?,fake_sent1,What is 'lipstick' used for?,gen,open presents,It's Christmas Eve,make your lips shine,gift exchange,2
194,daily-dialogue-1136-triplet-3,0,What does 'feel well enough' cause?,fake_sent1,What does 'feel well enough' cause?,gen,go to school,give you the assignments from English class,Thank you very much,went to school,0
3447,dream-0808-triplet-3,0,What does 'the campaign was late' cause?,fake_sent1,What does 'the campaign was late' cause?,gen,to repeat the campaign next year for free,lost business,campaign failed,did not appear into key magazines,3
4242,mutual-0242-triplet-2,0,What is implied by 'talk with you or mom when i feel sad'?,fake_sent1,What is implied by 'talk with you or mom when i feel sad'?,gen,rely on us,ca n't talk in the classroom,get in touch with your friends,do n't call my friends,0
751,dream-0561-triplet-5,0,What prerequisite does 'find a job' have?,fake_sent1,What prerequisite does 'find a job' have?,gen,attend your class,submitted a job application,tell me where your office,tell her I'll be there at 4:00,1
3264,dream-0379-triplet-8,0,What prerequisite does 'get a reception at the White House' have?,fake_sent1,What prerequisite does 'get a reception at the White House' have?,gen,stay longer,walking,like the White House,do something important,3
81,daily-dialogue-1050-triplet-5,0,What prerequisite does 'job interview' have?,fake_sent1,What prerequisite does 'job interview' have?,gen,come into my office,writing experience,interview,written,1
2265,mutual-1008-triplet-1,0,Where is 'carpet' located?,fake_sent1,Where is 'carpet' located?,gen,former roommates,carpet,place,living room,3
4008,dream-0496-triplet-12,0,What property does 'Mrs. Wong' have?,fake_sent1,What property does 'Mrs. Wong' have?,gen,been to the doctor,alright,under the weather,lost weight,3
1003,dream-0607-triplet-6,0,What desire is caused by 'enough time to work them out'?,fake_sent1,What desire is caused by 'enough time to work them out'?,gen,studying,one month to go before the exam,Don't worry,don't need to spend much time on other subjects,2
3755,dream-0873-triplet-1,0,What property does 'Norway' have?,fake_sent1,What property does 'Norway' have?,gen,cold,warm in summer,visiting Australia and New Zealand,Which countries,0
4072,dream-0515-triplet-2,0,What does 'something important came up and I have to rush off' cause?,fake_sent1,What does 'something important came up and I have to rush off' cause?,gen,Thank you,tell her not to wait for me this evening,isn't in,have to rush off,1
2935,dream-0170-triplet-1,0,Which goal motivates the act/action 'handing these out'?,fake_sent1,Which goal motivates the act/action 'handing these out'?,gen,warm-hearted,have some free time,gather some volunteers,free candies,2
2045,mutual-0001-triplet-1,0,What does 'most famous brand' cause?,fake_sent1,What does 'most famous brand' cause?,gen,hit our store,fortune,cheaper,learn how to play the piano,1
2205,mutual-0076-triplet-4,0,What does 'hit an ice patch' cause?,fake_sent1,What does 'hit an ice patch' cause?,gen,pretty bad accident,lost control of the car,a little frightened,i 'm lucky,1
501,dream-0224-triplet-8,0,What is a synonym of 'hitting the books all these days'?,fake_sent1,What is a synonym of 'hitting the books all these days'?,gen,busy,didn't quite catch you,studying so hard,tied up with my studies,3
573,dream-0244-triplet-4,0,What desire is caused by 'her brother already has a silk tie'?,fake_sent1,What desire is caused by 'her brother already has a silk tie'?,gen,a gift,taking a trip,buy a personal gift,like something unusual,3
220,daily-dialogue-1158-triplet-1,0,What prerequisite does 'go abroad' have?,fake_sent1,What prerequisite does 'go abroad' have?,gen,passport,passports,take it with us,keep it with us,1
1378,daily-dialogue-0092-triplet-2,0,What property does 'next President' have?,fake_sent1,What property does 'next President' have?,gen,most intelligent,who you ’ re going to vote for,great,can ’ t wait to vote,0
2288,mutual-1018-triplet-5,0,What does 'my parents announced they 'd be in finland' cause?,fake_sent1,What does 'my parents announced they 'd be in finland' cause?,gen,i was worried i 'd have to spend it alone,not,cold weather,having thanksgiving dinner,0
3299,dream-0402-triplet-1,0,What does 'pressure' cause?,fake_sent1,What does 'pressure' cause?,gen,lost sleep last night,explain the situation,hardly ever send any letters,I got a letter from my mum,0
3696,dream-0859-triplet-7,0,What is 'Soccer'?,fake_sent1,What is 'Soccer'?,gen,a very English game,good cricket player,Britain's most popular outdoor game,popular in the Commonwealth countries,2
2798,dream-0139-triplet-1,0,What desire is caused by 'you were coming to our city'?,fake_sent1,What desire is caused by 'you were coming to our city'?,gen,check my schedule,see you at your hotel,like to speak to Mr. Lee,What's your room number,1
1490,daily-dialogue-0143-triplet-7,0,What does 'lend the money' cause?,fake_sent1,What does 'lend the money' cause?,gen,cell phone is out of service again,No rush,pay you back,make my day,3
1300,daily-dialogue-0069-triplet-1,0,What does 'concert' have?,fake_sent1,What does 'concert' have?,gen,"do , very much .",Why,western music,listen,2
2828,dream-0144-triplet-10,0,What is implied by 'buy some medicine'?,fake_sent1,What is implied by 'buy some medicine'?,gen,sick,look a little sick,take you home,didn't come because I was sick,0
1369,daily-dialogue-0087-triplet-6,0,What does 'touching' cause?,fake_sent1,What does 'touching' cause?,gen,crying,Don ’ t be late,meet at the movie theater entrance,going to the movie theater,0
3733,dream-0869-triplet-4,0,What subevent does 'take your vacation' have?,fake_sent1,What subevent does 'take your vacation' have?,gen,counting the days,fishing,not,Hawaii,1
2655,dream-0106-triplet-7,0,What desire is caused by 'can't afford proper menus'?,fake_sent1,What desire is caused by 'can't afford proper menus'?,gen,leave,The music,on the blackboard,can't stand the noisy places,0
1200,daily-dialogue-0017-triplet-4,0,What is an antonym of 'harmless'?,fake_sent1,What is an antonym of 'harmless'?,gen,bite,get to know him better,never would have imagined that,wasn't real,0
3498,dream-0816-triplet-2,0,What does 'express train' cause?,fake_sent1,What does 'express train' cause?,gen,paying a little extra,We want to take a train to New York,train,pay,0
2737,dream-0121-triplet-1,0,What is 'help you' obstructed by?,fake_sent1,What is 'help you' obstructed by?,gen,can't understand this word,Oh?,watching something on TV,practicing my English,2
3679,dream-0856-triplet-2,0,What does 'got some water on it' cause?,fake_sent1,What does 'got some water on it' cause?,gen,my watch stopped running,afraid,needs a new battery,leave your watch,1
368,daily-dialogue-1211-triplet-5,0,What is 'have one free' used for?,fake_sent1,What is 'have one free' used for?,gen,king,book a hotel room,can fit you in,don't have,2
3265,dream-0379-triplet-9,0,What desire is caused by 'beautiful'?,fake_sent1,What desire is caused by 'beautiful'?,gen,get a reception at the White House,the president and his family,do something important,get the car,0
891,dream-0600-triplet-14,0,Which goal motivates the act/action 'go to the library'?,fake_sent1,Which goal motivates the act/action 'go to the library'?,gen,good at swimming,midterm exams,join me,look for some important books,3
960,dream-0605-triplet-16,0,Which goal motivates the act/action 'checked the course over at the community college'?,fake_sent1,Which goal motivates the act/action 'checked the course over at the community college'?,gen,courses are actually cheaper,did me a favor by putting me on evenings,pay my tuition,course during the day,3
2652,dream-0106-triplet-4,0,What is 'table' located near?,fake_sent1,What is 'table' located near?,gen,leave,noisy places,The music group,booked one for two,2
2231,mutual-0104-triplet-3,0,What does 'too rough for me' cause?,fake_sent1,What does 'too rough for me' cause?,gen,get tired of football games,watch it with me,one of the best games of the year,better things to do with my sunday afternoons,3
3775,dream-0876-triplet-8,0,What does 'only needed to revise it' cause?,fake_sent1,What does 'only needed to revise it' cause?,gen,revise it,pick it up so quickly and easily,weren't you at the German class,given up,1
2370,mutual-1084-triplet-1,0,What does 'motor failed' cause?,fake_sent1,What does 'motor failed' cause?,gen,laid up in a hospital over there for 3 weeks,"love racing , even when it pains me",was hit by another motorcycle,did n't know it would be this bad,2
1130,daily-dialogue-0001-triplet-6,0,When does 'gift exchange' happen?,fake_sent1,When does 'gift exchange' happen?,gen,lips shine,Time to open presents,Christmas Eve,Christmas party,3
3606,dream-0836-triplet-3,0,What does 'see someone like his grandfather' cause?,fake_sent1,What does 'see someone like his grandfather' cause?,gen,everything happened just like a film,tell you later,surprised,Exactly.,2
2986,dream-0304-triplet-4,0,What is 'Master Card'?,fake_sent1,What is 'Master Card'?,gen,awfully sorry,Visa Card,credit card,pay with cash,2
1091,mutual-0292-triplet-5,0,What does 'i must work to help support my family' cause?,fake_sent1,What does 'i must work to help support my family' cause?,gen,did n't you go to college,please tell me something about yourself,studying in high school,my mother makes too little money,0
1875,dream-0033-triplet-1,0,Which goal motivates the act/action 'tell me the time of the last plane'?,fake_sent1,Which goal motivates the act/action 'tell me the time of the last plane'?,gen,a little late,any change on that flight,book a flight,room number,2
595,dream-0251-triplet-6,0,What desire is caused by 'camped in the mountains'?,fake_sent1,What desire is caused by 'camped in the mountains'?,gen,enjoy your holiday in the country,camped in the mountains,cooked all our meals over an open fire,weather good,2
2127,mutual-0024-triplet-3,0,What does 'better go to sleep now' cause?,fake_sent1,What does 'better go to sleep now' cause?,gen,it 's too bad,romantic stuff,need some rest,rescued the princess from her kidnappers,0
1945,dream-0040-triplet-8,0,What does 'obeys the traffic rules' cause?,fake_sent1,What does 'obeys the traffic rules' cause?,gen,I,What was,be safe,injured people,2
1920,dream-0038-triplet-10,0,What does 'Up the mountains' cause?,fake_sent1,What does 'Up the mountains' cause?,gen,nobody to talk to,noise,had so much trouble,I've been looking for one over a year,0
