Unnamed: 0,video-id,fold-ind,startphrase,sent1,sent2,gold-source,ending0,ending1,ending2,ending3,label
3608,dream-0837-triplet-1,0,What property does 'New Scientist' have?,fake_sent1,What property does 'New Scientist' have?,gen,costs a lot of money,it's for anyone,try out on business,can only show a still black-and-white image,1
1847,dream-0021-triplet-7,0,What is implied by 'don't have to write'?,fake_sent1,What is implied by 'don't have to write'?,gen,stay at home,I'll do that,free,I must write some emails,2
197,daily-dialogue-1139-triplet-1,0,What property does 'nice apples' have?,fake_sent1,What property does 'nice apples' have?,gen,fruit store,tangerines,very fresh,Anything,2
3527,dream-0822-triplet-2,0,Which goal motivates the act/action 'want a lipstick'?,fake_sent1,Which goal motivates the act/action 'want a lipstick'?,gen,different shades of Lyfel lipstick,look more serious,have a try,this one,1
2690,dream-0114-triplet-3,0,Which goal motivates the act/action 'To the cinema'?,fake_sent1,Which goal motivates the act/action 'To the cinema'?,gen,watch a film,lives by the sea,a very good film,want to go to the country,0
181,daily-dialogue-1099-triplet-6,0,What prerequisite does 'long hike' have?,fake_sent1,What prerequisite does 'long hike' have?,gen,bring him along,been hiking before,pretty far away from the city,get out of the city,1
233,daily-dialogue-1161-triplet-10,0,What property does 'house' have?,fake_sent1,What property does 'house' have?,gen,enter it,can't open the door,old,frightened,2
676,dream-0267-triplet-4,0,When does 'eating supper at home' happen?,fake_sent1,When does 'eating supper at home' happen?,gen,juice,Milk,tonight,get some milk and bread,2
777,dream-0572-triplet-5,0,What prerequisite does 'have a paper to work on' have?,fake_sent1,What prerequisite does 'have a paper to work on' have?,gen,serious studying,a paper,I wanted to stay,beach,0
2108,mutual-0014-triplet-4,0,What does 'what a long trip' cause?,fake_sent1,What does 'what a long trip' cause?,gen,a long trip,call it a day,here,beat from the drive,1
2678,dream-0111-triplet-7,0,What does 'time went by' cause?,fake_sent1,What does 'time went by' cause?,gen,like my job,Really,nurse,training,0
3116,dream-0349-triplet-2,0,What happens after 'go to a hotel in the mountains'?,fake_sent1,What happens after 'go to a hotel in the mountains'?,gen,go skiing,usually take it during the second or third week of January,ski,"No, not me",0
3687,dream-0858-triplet-6,0,What property does 'The touch and sound of the paper' have?,fake_sent1,What property does 'The touch and sound of the paper' have?,gen,find what I want,holding a paper and turning the pages,pleasant,don't really trust big advertisers,2
1834,dream-0015-triplet-11,0,What does 'go with me' cause?,fake_sent1,What does 'go with me' cause?,gen,I haven't got any plans yet,like to go with me,waiting for you at my home,there won't be too many people,2
1248,daily-dialogue-0043-triplet-4,0,What is 'You had an art class'?,fake_sent1,What is 'You had an art class'?,gen,talented,talent,paint,draw and paint,0
1268,daily-dialogue-0054-triplet-1,0,What does 'he didn't tell me about it' cause?,fake_sent1,What does 'he didn't tell me about it' cause?,gen,John got married,feel bad,Because ...,I promise .,1
577,dream-0246-triplet-1,0,What is 'buy the clock radio' obstructed by?,fake_sent1,What is 'buy the clock radio' obstructed by?,gen,radio,handsome electric clock radio,don't accept credit cards in this family-run store,model that should suit you perfectly,2
1096,mutual-0293-triplet-2,0,What is 'clothes' used for?,fake_sent1,What is 'clothes' used for?,gen,scarf,snow,buy a pair,skiing,3
3212,dream-0367-triplet-5,0,What is 'have a pineapple pie' obstructed by?,fake_sent1,What is 'have a pineapple pie' obstructed by?,gen,Here you are,have a pineapple pie,there isn't any more,chocolate cake,2
1647,daily-dialogue-0331-triplet-1,0,What does 'no children' cause?,fake_sent1,What does 'no children' cause?,gen,Come back,took some newspaper away without paying,live by himself,You haven't paid yet,2
2271,mutual-1012-triplet-1,0,What does 'joined the running club' cause?,fake_sent1,What does 'joined the running club' cause?,gen,glad,very challenging,made quite a few friends,requires the knowledge of many other fields such as politics and law but i like it,2
1797,dream-0004-triplet-1,0,What does 'that is the only thing I can cook' cause?,fake_sent1,What does 'that is the only thing I can cook' cause?,gen,want to have,You'll drive,"OK, OK",We've had such things,3
3256,dream-0378-triplet-1,0,Which goal motivates the act/action 'work this summer'?,fake_sent1,Which goal motivates the act/action 'work this summer'?,gen,earn a lot of money,make some extra money,"No, only a little",part-time job,1
2889,dream-0158-triplet-3,0,What desire is caused by 'interested in finance'?,fake_sent1,What desire is caused by 'interested in finance'?,gen,be a doctor,ideas for the future,go to Hong Kong University,having a good time,2
1953,dream-0043-triplet-5,0,What prerequisite does 'take the test' have?,fake_sent1,What prerequisite does 'take the test' have?,gen,traffic rules,study the traffic rules,drive in your own country,driver's license,0
802,dream-0576-triplet-4,0,Which goal motivates the act/action 'study for it.'?,fake_sent1,Which goal motivates the act/action 'study for it.'?,gen,go with Dan,can't afford to fail the test,go next week,can't go,1
4037,dream-0498-triplet-8,0,What does 'staggered starts' cause?,fake_sent1,What does 'staggered starts' cause?,gen,Good cyclists can do it in four hours,How many people will be taking part,doubt they'll block the road,avoid these problems,3
4138,dream-0005-triplet-1,0,Where is 'ticket' located?,fake_sent1,Where is 'ticket' located?,gen,hooking office,flights to New York,an: It's five to eight.,Excuse me,0
1887,dream-0034-triplet-7,0,What does 'Nineteen's' cause?,fake_sent1,What does 'Nineteen's' cause?,gen,shouldn't spend so much time,must be patient,washing down the kitchen,spend so much time with that girl,3
38,daily-dialogue-1014-triplet-2,0,What is 'plum red'?,fake_sent1,What is 'plum red'?,gen,water proof,take it,nice,color,3
2478,mutual-1160-triplet-4,0,What does 'it started raining' cause?,fake_sent1,What does 'it started raining' cause?,gen,how was the camping,it was getting dark,"left the house early on saturday morning , but after only half an hour my car broke down",we drove down the road for 2 hours and found a hotel,3
2071,mutual-0008-triplet-3,0,What prerequisite does 'too many classes to go' have?,fake_sent1,What prerequisite does 'too many classes to go' have?,gen,too many classes,work,free time,working is totally unnecessary,2
2721,dream-0117-triplet-3,0,What does 'going off to Beijing' cause?,fake_sent1,What does 'going off to Beijing' cause?,gen,arrives in Beijing at 7:10 tomorrow morning,seeing you off,Goodbye,I get back,1
2409,mutual-1123-triplet-2,0,What does 'my parents bought a new flat in town' cause?,fake_sent1,What does 'my parents bought a new flat in town' cause?,gen,lucky you did n't,say hello,we 're there now,james,2
3272,dream-0381-triplet-2,0,What does 'She's studying for an exam' cause?,fake_sent1,What does 'She's studying for an exam' cause?,gen,expensive,Kate,going to night school,She isn't working,3
471,dream-0214-triplet-3,0,What desire is caused by 'had a test week'?,fake_sent1,What desire is caused by 'had a test week'?,gen,not to give a test again soon,Why not,had a test week,have a quiz,0
364,daily-dialogue-1211-triplet-1,0,What prerequisite does 'get a room for the night' have?,fake_sent1,What prerequisite does 'get a room for the night' have?,gen,600 RIB,reservation,Smoking or non-smoking,possible,1
1399,daily-dialogue-0108-triplet-1,0,What prerequisite does 'TV' have?,fake_sent1,What prerequisite does 'TV' have?,gen,channels,converter,ready,for,1
3894,dream-0476-triplet-13,0,What is implied by 'almost all the books there'?,fake_sent1,What is implied by 'almost all the books there'?,gen,books,favor,It's not here,me,2
57,daily-dialogue-1022-triplet-1,0,What does 'ID card is lost' cause?,fake_sent1,What does 'ID card is lost' cause?,gen,Why,what's,new identification card,need them taken,2
1495,daily-dialogue-0145-triplet-1,0,What does 'shower' cause?,fake_sent1,What does 'shower' cause?,gen,there isn't any hot water,Ok,getting cold,slippery,3
1278,daily-dialogue-0064-triplet-2,0,What does 'pulled you over' cause?,fake_sent1,What does 'pulled you over' cause?,gen,go to court,find that out,write you a ticket,have the ticket,2
286,daily-dialogue-1182-triplet-4,0,Where is 'gym' located?,fake_sent1,Where is 'gym' located?,gen,gym,room key,hotel,where it is,2
1489,daily-dialogue-0143-triplet-6,0,What is implied by 'Is that enough'?,fake_sent1,What is implied by 'Is that enough'?,gen,need to gather money,have to pay the mortgage,lend the money,Awful,2
3290,dream-0390-triplet-5,0,What does 'forgot my ammo back at the truck' cause?,fake_sent1,What does 'forgot my ammo back at the truck' cause?,gen,have to sit here and watch,sit here and watch,scare the deer away,see the deer,0
1010,dream-0607-triplet-13,0,What does 'one month to go before the exam' cause?,fake_sent1,What does 'one month to go before the exam' cause?,gen,My English class ran late again,enough time to work them out,ready for the exams,pay more attention to my weak subjects,1
970,dream-0606-triplet-2,0,Which goal motivates the act/action 'offto the gym'?,fake_sent1,Which goal motivates the act/action 'offto the gym'?,gen,join me at the gym,watch sports on TV,Where are you heading with that big bag,got to stay in shape,3
3457,dream-0809-triplet-4,0,What property does 'made all the products ourselves' have?,fake_sent1,What property does 'made all the products ourselves' have?,gen,mildly green,find the money,have your own company,wasteful,3
3099,dream-0343-triplet-3,0,What does 'working until around ten every night' cause?,fake_sent1,What does 'working until around ten every night' cause?,gen,Good.,won't come back for several more weeks,set it with the radio,tired,3
1471,daily-dialogue-0136-triplet-6,0,What is a synonym of 'almost positive'?,fake_sent1,What is a synonym of 'almost positive'?,gen,sign,doesn't look like we're on our way to Altadena,never trusting you with the bus schedules,not completely sure,3
3744,dream-0870-triplet-7,0,Which goal motivates the act/action 'hired any employees'?,fake_sent1,Which goal motivates the act/action 'hired any employees'?,gen,wish you success in your new business,didn't let anything stand in my way,help me out,keep regular hours,2
2057,mutual-0004-triplet-2,0,What prerequisite does 'learn' have?,fake_sent1,What prerequisite does 'learn' have?,gen,remember,increases family time,teaching materials,children will not go to school,2
1516,daily-dialogue-0148-triplet-5,0,What is 'leather shoes'?,fake_sent1,What is 'leather shoes'?,gen,leather shoes,dress well,OK,formal occasions,1
1301,daily-dialogue-0069-triplet-2,0,"What does 'No , nothing' cause?",fake_sent1,"What does 'No , nothing' cause?",gen,"Oh , yes .",go and listen to it,like western music,Are you doing anything,1
2531,daily-dialogue-3503-triplet-1,0,Which goal motivates the act/action 'getting together'?,fake_sent1,Which goal motivates the act/action 'getting together'?,gen,getting together,Christmas,my parents,open our gifts together,1
722,dream-0274-triplet-13,0,"What is 'your name, your address and telephone number' used for?",fake_sent1,"What is 'your name, your address and telephone number' used for?",gen,find it,fill out this report,handbag,coffee shop,1
1977,dream-0050-triplet-3,0,What is 'You could have an accident' obstructed by?,fake_sent1,What is 'You could have an accident' obstructed by?,gen,late,count on me,Drive slowly,policeman,1
4187,dream-0704-triplet-4,0,What is implied by 'The weather's going to be like this for the next three months'?,fake_sent1,What is implied by 'The weather's going to be like this for the next three months'?,gen,know a lot about the weather,I'm going to Florida,The weather's going to be like this,should be a weather reporter,1
1615,daily-dialogue-0185-triplet-1,0,What does 'withdraw some money' cause?,fake_sent1,What does 'withdraw some money' cause?,gen,cash,Here's my bank book,fine,Can I help you,0
1026,mutual-0264-triplet-2,0,What desire is caused by 'given me some very good suggestions'?,fake_sent1,What desire is caused by 'given me some very good suggestions'?,gen,thank you for your help with my paper,books,interested in your paper and i happen to have some books,thank you so much,3
2930,dream-0169-triplet-2,0,What is 'an overnight service' used for?,fake_sent1,What is 'an overnight service' used for?,gen,three-day service,overnight service,service guaranteed,send this package,3
2793,dream-0138-triplet-5,0,What is 'play tennis' a manner of?,fake_sent1,What is 'play tennis' a manner of?,gen,health habits,exercise,eat good food,How often do you take medicine,1
3266,dream-0380-triplet-1,0,What does 'color is too light.' cause?,fake_sent1,What does 'color is too light.' cause?,gen,buy,feel a bit tight at the shoulders,easily gets dirty,Try it on,2
55,daily-dialogue-1018-triplet-1,0,What subevent does 'reservation' have?,fake_sent1,What subevent does 'reservation' have?,gen,very kind of you,table reserved,Good morning,order,1
300,daily-dialogue-1184-triplet-7,0,Where is 'get online' located?,fake_sent1,Where is 'get online' located?,gen,No problem .,set up for wireless,lobby,computer,3
1310,daily-dialogue-0071-triplet-3,0,What does 'a lot of pressure' cause?,fake_sent1,What does 'a lot of pressure' cause?,gen,feeling OK,under a lot of pressure,stomach is bothering,didn ’ t feel so well,2
2280,mutual-1016-triplet-6,0,What is 'like things neat and organized' obstructed by?,fake_sent1,What is 'like things neat and organized' obstructed by?,gen,i 'm tired of cleaning her mess,worried,late every month,put up with her,0
1390,daily-dialogue-0103-triplet-3,0,What is 'PCC'?,fake_sent1,What is 'PCC'?,gen,a freshman in college,school,Good luck,loved PCC,1
519,dream-0228-triplet-2,0,Which goal motivates the act/action 'stand up all the time'?,fake_sent1,Which goal motivates the act/action 'stand up all the time'?,gen,Don't worry,see the match clearly,right behind the goal,the better,1
1896,dream-0035-triplet-7,0,What does 'It wasn't really what I expected' cause?,fake_sent1,What does 'It wasn't really what I expected' cause?,gen,can't wait that long,disappointing,seeing it at home,that,1
4228,mutual-0232-triplet-2,0,Which goal motivates the act/action 'shopping'?,fake_sent1,Which goal motivates the act/action 'shopping'?,gen,big dance,i can do that,find a dress,take me shopping,2
296,daily-dialogue-1184-triplet-3,0,What prerequisite does 'print something' have?,fake_sent1,What prerequisite does 'print something' have?,gen,printer,set up for wireless,go to the lab,pay a nominal printing fee,2
3700,dream-0861-triplet-2,0,What does 'none of the teachers liked me' cause?,fake_sent1,What does 'none of the teachers liked me' cause?,gen,want me to go back and talk to them,I don't know,are you going,bad at studies,3
315,daily-dialogue-1194-triplet-2,0,What is implied by 'got back from Hawaii'?,fake_sent1,What is implied by 'got back from Hawaii'?,gen,meeting,in a hurry,had a good time,Great,2
378,daily-dialogue-1218-triplet-2,0,What desire is caused by 'left it in the car'?,fake_sent1,What desire is caused by 'left it in the car'?,gen,go and get my ID,ID,see your ID,apply for a permit,0
637,dream-0260-triplet-9,0,What is 'summarize the main idea of the passage' obstructed by?,fake_sent1,What is 'summarize the main idea of the passage' obstructed by?,gen,go to the doctor,ate something bad,Thank you so much,not feeling well,3
2627,dream-0098-triplet-3,0,Which goal motivates the act/action 'book tickets to Sanya'?,fake_sent1,Which goal motivates the act/action 'book tickets to Sanya'?,gen,leads the world in beautiful scenery,3:30 one,book tickets to Sanya,To tell the truth,0
1043,mutual-0276-triplet-4,0,What is 'russian'?,fake_sent1,What is 'russian'?,gen,language that you want to learn,offer the courses,learn a foreign language,foreign language,3
1522,daily-dialogue-0148-triplet-11,0,What desire is caused by 'after the party'?,fake_sent1,What desire is caused by 'after the party'?,gen,wear,pick me up,smart,go home,3
3441,dream-0807-triplet-2,0,What desire is caused by 'he doesn't like it'?,fake_sent1,What desire is caused by 'he doesn't like it'?,gen,can't put that back on the shelf,have the receipt,tie,change it for something else,3
2628,dream-0099-triplet-1,0,What happens after 'got a degree in English'?,fake_sent1,What happens after 'got a degree in English'?,gen,special skills,tell me a little about yourself,Jerry Lynn,working abroad doing secretarial work,3
2796,dream-0138-triplet-8,0,Which goal motivates the act/action 'ask you a few questions'?,fake_sent1,Which goal motivates the act/action 'ask you a few questions'?,gen,making a survey,Dr. Bean,try to eat good food,How often do you take medicine,0
3652,dream-0848-triplet-2,0,Which goal motivates the act/action 'buy that book'?,fake_sent1,Which goal motivates the act/action 'buy that book'?,gen,listening to his students,it's awfully expensive,sharing the book,buy that book,1
2047,mutual-0001-triplet-3,0,What does 'priced at only $ 620' cause?,fake_sent1,What does 'priced at only $ 620' cause?,gen,cheaper,quality is guaranteed,too dear for me,$ 600,1
1618,daily-dialogue-0185-triplet-4,0,When does 'stating the exact amount' happen?,fake_sent1,When does 'stating the exact amount' happen?,gen,bank book,help,Fill in the slip,large notes,2
2877,dream-0155-triplet-1,0,What property does 'going to a concert' have?,fake_sent1,What property does 'going to a concert' have?,gen,exciting,I'm going to visit my uncle,going to a concert,Kangkang,0
3588,dream-0834-triplet-4,0,What does 'interested in the history of film' cause?,fake_sent1,What does 'interested in the history of film' cause?,gen,enjoy using a film camera,preparing my fishing tools,very interested in making home movies,fishing,0
3780,dream-0877-triplet-5,0,What does 'Someone's stolen some of my valuables' cause?,fake_sent1,What does 'Someone's stolen some of my valuables' cause?,gen,the door was locked,upset,see the manager immediately,they were.,1
1729,daily-dialogue-0465-triplet-5,0,What is 'coffee' used for?,fake_sent1,What is 'coffee' used for?,gen,leave the car in the parking lot,cold,warm up,keep it well below zero,2
2403,mutual-1121-triplet-4,0,What does 'changed my mind' cause?,fake_sent1,What does 'changed my mind' cause?,gen,keeps you from joining your beloved family,not going home,"hi , jack",work at his uncle 's institution,1
1505,daily-dialogue-0146-triplet-1,0,What is a synonym of 'trip'?,fake_sent1,What is a synonym of 'trip'?,gen,trip,on a vacation,go together,tour,3
1916,dream-0038-triplet-6,0,What does 'stayed in Puerto Rico in the first place' cause?,fake_sent1,What does 'stayed in Puerto Rico in the first place' cause?,gen,don't like the city,so much trouble,too many people,go to Puerto Rico for a visit,1
3821,dream-0885-triplet-2,0,Which goal motivates the act/action 'pretending he's from the electricity board'?,fake_sent1,Which goal motivates the act/action 'pretending he's from the electricity board'?,gen,steals their money,stole,slight northern accent,Gosh,0
2589,dream-0080-triplet-2,0,What is 'PC'?,fake_sent1,What is 'PC'?,gen,Of course,computer,"Good afternoon, madam",personal computer,3
3276,dream-0385-triplet-1,0,What is implied by 'table tennis bat broke'?,fake_sent1,What is implied by 'table tennis bat broke'?,gen,bring an extra one,she has probably forgotten it all together,I am her brother,Judy has an extra one,0
574,dream-0244-triplet-5,0,What desire is caused by 'My sister already gave him one'?,fake_sent1,What desire is caused by 'My sister already gave him one'?,gen,like something unusual,silk tie,May I help you,gave him one,0
2482,mutual-1169-triplet-1,0,What does 'not really' cause?,fake_sent1,What does 'not really' cause?,gen,got hit by a car,drivers see bonzo,it 's not about me,bonzo was running too fast,3
1225,daily-dialogue-0029-triplet-5,0,What does 'pump the volume up way too high' cause?,fake_sent1,What does 'pump the volume up way too high' cause?,gen,they're really safe,Cool,hear outside noises,sound damage,3
2342,mutual-1058-triplet-4,0,What is 'cut the grass'?,fake_sent1,What is 'cut the grass'?,gen,see the latest movie,do this kind of work,i help around the house,grass,2
4235,mutual-0239-triplet-1,0,What desire is caused by 'birthday'?,fake_sent1,What desire is caused by 'birthday'?,gen,having a party,invited me to spend the night,birthday,call me when you want me to pick you up,0
2257,mutual-1005-triplet-6,0,What does 'wanted to do philosophy rather than english' cause?,fake_sent1,What does 'wanted to do philosophy rather than english' cause?,gen,my parents did n't let me,have to read it for a seminar,it does n't really hold your interest,hold your interest,2
3659,dream-0849-triplet-3,0,What happens after 'go to the gym'?,fake_sent1,What happens after 'go to the gym'?,gen,go to see a movie,get to work,taking a hike,midnight,1
562,dream-0243-triplet-1,0,What does 'sent to the hospital' cooccur with?,fake_sent1,What does 'sent to the hospital' cooccur with?,gen,headache,Mum asked me to see her nephew,his leg was hurt,in the hospital,2
40,daily-dialogue-1014-triplet-4,0,When does 'gift' happen?,fake_sent1,When does 'gift' happen?,gen,gift wrap it,colors,Good morning,birthday,3
1562,daily-dialogue-0163-triplet-6,0,Where is 'lock' located?,fake_sent1,Where is 'lock' located?,gen,hardware store,carry my backpack,lock,locker,0
1663,daily-dialogue-0396-triplet-6,0,What is 'great confidence in you' a manner of?,fake_sent1,What is 'great confidence in you' a manner of?,gen,confidence,getting mush on me,putting a little something together,proud I am of you,3
4032,dream-0498-triplet-3,0,When does 'mountain lake cycle tour' happen?,fake_sent1,When does 'mountain lake cycle tour' happen?,gen,staggered,cycle,today,seven o'clock,2
2085,mutual-0010-triplet-2,0,What does 'i was at an art exhibition' cause?,fake_sent1,What does 'i was at an art exhibition' cause?,gen,going to exhibitions,anything wrong with your phone,love going to pop concerts,turned off,3
394,daily-dialogue-1228-triplet-4,0,What is implied by 'wouldn't stop talking throughout the class'?,fake_sent1,What is implied by 'wouldn't stop talking throughout the class'?,gen,What was he doing,acting up in class,help,talk to him,1
2741,dream-0121-triplet-5,0,What is 'help you' obstructed by?,fake_sent1,What is 'help you' obstructed by?,gen,hasn't been home yet,hasn't been home,watching a cowboy film,calling her boyfriend,1
530,dream-0230-triplet-7,0,Which goal motivates the act/action 'read this letter I've just written'?,fake_sent1,Which goal motivates the act/action 'read this letter I've just written'?,gen,have your opinion,the second part,write about your education,make the cover letter better,3
2414,mutual-1128-triplet-1,0,What does 'one of them got angry' cause?,fake_sent1,What does 'one of them got angry' cause?,gen,bitten by a big bird,really hurt,bit him,active than those at the zoo,2
2984,dream-0304-triplet-2,0,What is 'Visa'?,fake_sent1,What is 'Visa'?,gen,credit card,Visa Card,pay with cash,awfully sorry,0
2066,mutual-0007-triplet-1,0,What does 'their food is always good' cause?,fake_sent1,What does 'their food is always good' cause?,gen,eat there a lot,like it a lot,great idea,i eat there a lot,3
2939,dream-0170-triplet-5,0,What is 'diaper changers' a manner of?,fake_sent1,What is 'diaper changers' a manner of?,gen,volunteer,playground assistants,warm-hearted,Great,0
3453,dream-0808-triplet-9,0,What does 'did not appear into key magazines' cause?,fake_sent1,What does 'did not appear into key magazines' cause?,gen,run the campaign for four extra weeks,lost business,to repeat the campaign next year for free,free repeat campaign,1
806,dream-0578-triplet-2,0,What is 'go for a picnic' obstructed by?,fake_sent1,What is 'go for a picnic' obstructed by?,gen,be there,coach a football team,game,have a game tomorrow,2
2632,dream-0100-triplet-1,0,What prerequisite does 'Round trip' have?,fake_sent1,What prerequisite does 'Round trip' have?,gen,coach,2:15,a ticket,baggage ticket,2
189,daily-dialogue-1103-triplet-6,0,Which goal motivates the act/action 'hand out some fliers'?,fake_sent1,Which goal motivates the act/action 'hand out some fliers'?,gen,Why are so many extra gifts left,get back home,throw them into the trash can,attract customers,3
3152,dream-0354-triplet-8,0,What is implied by 'stop at the drugstore'?,fake_sent1,What is implied by 'stop at the drugstore'?,gen,have to stop at the drugstore,be able to take a make-up,sick,able to drive,2
234,daily-dialogue-1161-triplet-11,0,Which goal motivates the act/action 'ask the old woman in that reception office'?,fake_sent1,Which goal motivates the act/action 'ask the old woman in that reception office'?,gen,open the door,deaf,it,ask the old woman,0
3109,dream-0347-triplet-1,0,What prerequisite does 'learn skating' have?,fake_sent1,What prerequisite does 'learn skating' have?,gen,you,free,balance,buy a pair of skates,2
689,dream-0269-triplet-4,0,Where is 'watched Gone with the Wind' located?,fake_sent1,Where is 'watched Gone with the Wind' located?,gen,Monday,playing again,home,last night,2
680,dream-0267-triplet-8,0,What is 'want to be healthy' obstructed by?,fake_sent1,What is 'want to be healthy' obstructed by?,gen,have bread and juice,be healthy,soda,eating supper,2
832,dream-0589-triplet-5,0,What does 'my motor failed and was hit by another motorcycle' cause?,fake_sent1,What does 'my motor failed and was hit by another motorcycle' cause?,gen,Bob,meeting someone after accident killing someone someone close had a terrible accident,beautiful flowers,broke both my legs,3
