Unnamed: 0,video-id,fold-ind,startphrase,sent1,sent2,gold-source,ending0,ending1,ending2,ending3,label
2192,mutual-0069-triplet-2,0,What prerequisite does 'sing' have?,fake_sent1,What prerequisite does 'sing' have?,gen,nervous,a whole bunch of other people,no,great voice,1
1005,dream-0607-triplet-8,0,What does 'students hanging around the professor asking questions' cause?,fake_sent1,What does 'students hanging around the professor asking questions' cause?,gen,looking for you,don't need to spend much time on other subjects,ready for the exams,class ran late again,3
1124,mutual-0301-triplet-3,0,Where is 'paintings' located?,fake_sent1,Where is 'paintings' located?,gen,paintings,bus,art gallery,wait for him,2
1961,dream-0047-triplet-5,0,What is implied by 'She is busy with her dancing class'?,fake_sent1,What is implied by 'She is busy with her dancing class'?,gen,she doesn't think so,not free,crazy about dancing,busy with her dancing class,1
720,dream-0274-triplet-11,0,What desire is caused by 'lost my handbag'?,fake_sent1,What desire is caused by 'lost my handbag'?,gen,report the lost item return the lost item when found,What's in the bag,report the lost item,"give me your name, your address and telephone number",2
3530,dream-0823-triplet-3,0,What happens after 'take the meat out of the fridge'?,fake_sent1,What happens after 'take the meat out of the fridge'?,gen,make dinner,wash the onions,kitchen,meat stuffing,0
1717,daily-dialogue-0444-triplet-1,0,What does 'parking in the red zone' cause?,fake_sent1,What does 'parking in the red zone' cause?,gen,parked,parking ticket,don't understand,got one the other day,1
2556,daily-dialogue-3513-triplet-5,0,What property does 'cereal' have?,fake_sent1,What property does 'cereal' have?,gen,hearty breakfast,oatmeal and toast,not time consuming,unhealthy,3
1366,daily-dialogue-0087-triplet-3,0,What is a synonym of 'crying'?,fake_sent1,What is a synonym of 'crying'?,gen,No problem,get a lump in my throat,blockbuster,going to the movie theater,1
4017,dream-0497-triplet-1,0,What desire is caused by 'lost my coat'?,fake_sent1,What desire is caused by 'lost my coat'?,gen,you can help,Sorry,long white overcoat,have your name and your telephone number,0
487,dream-0221-triplet-5,0,What does 'return it' cause?,fake_sent1,What does 'return it' cause?,gen,show us the receipt,buy,"No, thank you",give you a refund,3
541,dream-0240-triplet-1,0,What happens after 'borrow your notes'?,fake_sent1,What happens after 'borrow your notes'?,gen,going there anyway,missed any classes,return them tomorrow,notes aren't very good,2
3809,dream-0882-triplet-6,0,What does 'dark the whole time' cause?,fake_sent1,What does 'dark the whole time' cause?,gen,the sun has been down,play with flashlights,wouldn't be able to handle that,not the whole time,1
3028,dream-0315-triplet-3,0,Which goal motivates the act/action 'bring your wife'?,fake_sent1,Which goal motivates the act/action 'bring your wife'?,gen,serve you some more fish,haven't seen her,learn to cook from you,bring your wife,2
3779,dream-0877-triplet-4,0,What is implied by 'door was locked'?,fake_sent1,What is implied by 'door was locked'?,gen,not good enough,want my things back,It can only be one of your staff,the door was locked,2
1109,mutual-0295-triplet-2,0,What does 'talking on your mobile phone' cause?,fake_sent1,What does 'talking on your mobile phone' cause?,gen,did n't see you stop,had the phone up to your ear,do n't know what you 're talking about,terribly sorry,0
2380,mutual-1088-triplet-2,0,What is 'answering phones and typing documents' obstructed by?,fake_sent1,What is 'answering phones and typing documents' obstructed by?,gen,qualified,ad,concentrate in a noisy environment,"hire you , your position will be temporary",2
3607,dream-0836-triplet-4,0,What is 'see someone like his grandfather' obstructed by?,fake_sent1,What is 'see someone like his grandfather' obstructed by?,gen,what?,an old man at the railway station selling newspapers,everybody thought he had been killed in the war,used to be an army officer during the war,2
3321,dream-0413-triplet-3,0,What is implied by 'stay with them a lot'?,fake_sent1,What is implied by 'stay with them a lot'?,gen,I am.,don't always get on very well with them,try to control me too much,staying ... very close to your parents,3
447,dream-0197-triplet-3,0,Which goal motivates the act/action 'need a summer job'?,fake_sent1,Which goal motivates the act/action 'need a summer job'?,gen,give me some exercise,being a life guard,usually just sit,swim,0
1524,daily-dialogue-0148-triplet-13,0,What is 'pick me up' obstructed by?,fake_sent1,What is 'pick me up' obstructed by?,gen,too late,pick me up after the party,go home,formal,0
2077,mutual-0008-triplet-9,0,What is 'work while in college' obstructed by?,fake_sent1,What is 'work while in college' obstructed by?,gen,what about you,sports,working is totally unnecessary,work,1
953,dream-0605-triplet-9,0,Which goal motivates the act/action 'work in the cafe'?,fake_sent1,Which goal motivates the act/action 'work in the cafe'?,gen,pay my tuition,offered in the evening,idea,not so great,0
3113,dream-0348-triplet-2,0,What does 'had the originals' cause?,fake_sent1,What does 'had the originals' cause?,gen,be a wealthy man,loved it for 9 years,gives you much pleasure,Really,0
3197,dream-0364-triplet-1,0,What is 'come to dinner' obstructed by?,fake_sent1,What is 'come to dinner' obstructed by?,gen,bring,Saturday,bring yourself,busy,3
3332,dream-0418-triplet-7,0,Where is 'doctor' located?,fake_sent1,Where is 'doctor' located?,gen,supper,don,town,clinic,3
994,dream-0606-triplet-26,0,What does 'offto the gym' cause?,fake_sent1,What does 'offto the gym' cause?,gen,I forgot about that,sports,health,offto the gym,2
1994,dream-0056-triplet-7,0,Where is 'post office' located?,fake_sent1,Where is 'post office' located?,gen,Xinhua Road,bye,across the street,map of the city,2
2683,dream-0113-triplet-3,0,What prerequisite does 'pick you up' have?,fake_sent1,What prerequisite does 'pick you up' have?,gen,trouble,no trouble,81881688,call me,3
3504,dream-0817-triplet-6,0,What is 'choose part-time jobs' obstructed by?,fake_sent1,What is 'choose part-time jobs' obstructed by?,gen,interested in having you join us,part-time jobs,-time,will not get any other benefits besides the wages,3
2408,mutual-1123-triplet-1,0,What does 'my parents bought a new flat in town' cause?,fake_sent1,What does 'my parents bought a new flat in town' cause?,gen,went past your house,have n't seen you for ages,lucky you did n't,james,1
567,dream-0243-triplet-6,0,What is 'go to the Children's Center' obstructed by?,fake_sent1,What is 'go to the Children's Center' obstructed by?,gen,asked me to see her nephew,go to the Children's Center,leg was hurt,have a bad cold,0
3950,dream-0491-triplet-2,0,What does 'problems' cause?,fake_sent1,What does 'problems' cause?,gen,don't think we can manage,send someone over,got rid of the old fridge,sorry,3
780,dream-0572-triplet-8,0,What is 'swimming' obstructed by?,fake_sent1,What is 'swimming' obstructed by?,gen,couldn't do any serious studying at the beach,what did you do,invited me for as long as I wanted to stay,water isn't warm enough,3
713,dream-0274-triplet-4,0,"Where is 'wallet, two keys, and a letter' located?",fake_sent1,"Where is 'wallet, two keys, and a letter' located?",gen,bag,handbag,fill out this report,wallet,0
1966,dream-0047-triplet-10,0,What does 'a very big performance' cause?,fake_sent1,What does 'a very big performance' cause?,gen,prepare for the performance,ask her,a very big performance in just a week,crazy about dancing,0
3517,dream-0820-triplet-5,0,What property does 'laughing' have?,fake_sent1,What property does 'laughing' have?,gen,felt really good,important,costs no money,scientifically proven,2
929,dream-0602-triplet-13,0,What is 'camping' used for?,fake_sent1,What is 'camping' used for?,gen,see some of the country,rent the equipment,haven't seen you,save money,0
1753,daily-dialogue-1006-triplet-2,0,What is 'latte'?,fake_sent1,What is 'latte'?,gen,Well,Good morning,coffee,latte,2
3519,dream-0820-triplet-7,0,What is 'laughing'?,fake_sent1,What is 'laughing'?,gen,workout,illness,learn to laugh,funny movies,0
4083,dream-0522-triplet-3,0,What desire is caused by 'small reception'?,fake_sent1,What desire is caused by 'small reception'?,gen,launch our summer holiday advertising campaign,how many should I cater for,do some catering,confirmation of the arrangements,2
2151,mutual-0034-triplet-3,0,What does 'once a week' cause?,fake_sent1,What does 'once a week' cause?,gen,have n't heard from my sister for 2 weeks,managers meeting is put off,so worried,what 's wrong,2
1455,daily-dialogue-0125-triplet-7,0,What is 'more squid balls'?,fake_sent1,What is 'more squid balls'?,gen,service,fruits,order more food,fruit,2
584,dream-0247-triplet-2,0,What is 'a pen' obstructed by?,fake_sent1,What is 'a pen' obstructed by?,gen,my brother,my brother gave him that for his bithday last year,graduating from college,How about a pen,1
3543,dream-0826-triplet-5,0,What does 'drove inside' cause?,fake_sent1,What does 'drove inside' cause?,gen,in the police station,had a fight,The car is still inside the store,last night,0
1971,dream-0049-triplet-4,0,What does 'feel sick' cause?,fake_sent1,What does 'feel sick' cause?,gen,bananas were not quite ripe,serious,"Help me, please",you'll be fine,2
3574,dream-0832-triplet-7,0,What does 'pubs' have?,fake_sent1,What does 'pubs' have?,gen,wine and beer,coffee,friendly,busy areas,1
2398,mutual-1117-triplet-2,0,What does 'company is paying all my expenses' cause?,fake_sent1,What does 'company is paying all my expenses' cause?,gen,four of us were chosen to go back for this interview,second interview with this company,paying all my expenses,"hi , jack",1
2827,dream-0144-triplet-9,0,What desire is caused by 'sick'?,fake_sent1,What desire is caused by 'sick'?,gen,take you home,Thanks a lot,stop at the chemist's,car,0
436,dream-0193-triplet-5,0,What is a synonym of 'going home'?,fake_sent1,What is a synonym of 'going home'?,gen,send you a letter,travelling,hospital,be back,1
956,dream-0605-triplet-12,0,What is 'ask someone that could switch hours with you' obstructed by?,fake_sent1,What is 'ask someone that could switch hours with you' obstructed by?,gen,My boss just did me a favor by putting me on evenings,"plenty of room, but I have to take the starter course",offer an introductory course during the day,course in evening,0
668,dream-0263-triplet-11,0,What is 'clean up my diet' used for?,fake_sent1,What is 'clean up my diet' used for?,gen,eating too much,clean up my diet,given any advice,lose weight,3
474,dream-0216-triplet-3,0,What prerequisite does 'sending a letter' have?,fake_sent1,What prerequisite does 'sending a letter' have?,gen,return address,sending address,not insured,the city it's going to and the district,0
1106,mutual-0294-triplet-5,0,What is 'playing the piano'?,fake_sent1,What is 'playing the piano'?,gen,music,classical music,activity,major objective is to learn from others,2
2968,dream-0178-triplet-3,0,What property does 'takes a short sleep for an hour every six hours' have?,fake_sent1,What property does 'takes a short sleep for an hour every six hours' have?,gen,highly effective,sleep during the day,full of energy,best way for human beings,0
100,daily-dialogue-1063-triplet-5,0,What happens after 'lost my wallet'?,fake_sent1,What happens after 'lost my wallet'?,gen,late,found it again,missed the bus,lost my wallet,1
2569,daily-dialogue-3517-triplet-4,0,What is 'skating'?,fake_sent1,What is 'skating'?,gen,interesting,sorry,rules,Aerobic sports,3
4195,mutual-0202-triplet-1,0,What is 'come to the movies with us' used for?,fake_sent1,What is 'come to the movies with us' used for?,gen,break,movies,been in the library,relax,3
2653,dream-0106-triplet-5,0,What is implied by 'on the wall'?,fake_sent1,What is implied by 'on the wall'?,gen,we've booked one for two,where's the menu,we have the table for you,can't afford proper menus,3
2348,mutual-1059-triplet-2,0,What does 'exhausted' cause?,fake_sent1,What does 'exhausted' cause?,gen,can barely keep my eyes open,"hi , mary",pretty productive,i can barely keep my eyes open,3
1588,daily-dialogue-0173-triplet-8,0,What property does 'live band' have?,fake_sent1,What property does 'live band' have?,gen,perfect condition,fun,checked into it,music need money,1
548,dream-0240-triplet-8,0,What does 'pretty tired when you come to class' cause?,fake_sent1,What does 'pretty tired when you come to class' cause?,gen,work,missed any classes,don't quite understand a why you need my notes,feel sleepy and have trouble keeping my eyes open,3
2200,mutual-0075-triplet-3,0,What desire is caused by 'i found a new way to learn chinese'?,fake_sent1,What desire is caused by 'i found a new way to learn chinese'?,gen,do tell me,made little progress,poor,trying to learn something new,0
1379,daily-dialogue-0092-triplet-3,0,What desire is caused by 'most intelligent'?,fake_sent1,What desire is caused by 'most intelligent'?,gen,vote,love my candidate,vote for,can ’ t wait to vote,2
3072,dream-0331-triplet-5,0,What property does 'Coal' have?,fake_sent1,What property does 'Coal' have?,gen,important,dirty,lecture,coal,1
205,daily-dialogue-1143-triplet-2,0,What desire is caused by 'We are hungry'?,fake_sent1,What desire is caused by 'We are hungry'?,gen,order food,remind you,good,bring our salads to us now,3
2730,dream-0119-triplet-3,0,What desire is caused by 'haven't watched a football match for a long time'?,fake_sent1,What desire is caused by 'haven't watched a football match for a long time'?,gen,match,All right.,go with me,watched a football,3
2329,mutual-1051-triplet-4,0,What does 'shortage of high school teachers' cause?,fake_sent1,What does 'shortage of high school teachers' cause?,gen,applied to 3 schools and each one offered me a position,sharon,difficult,take so much time,0
1469,daily-dialogue-0136-triplet-4,0,What does 'They are on the wrong bus' cause?,fake_sent1,What does 'They are on the wrong bus' cause?,gen,not completely sure,know which bus to catch,never trusting you with the bus schedules,doesn't look like we're on our way to Altadena,2
693,dream-0272-triplet-1,0,What prerequisite does 'send a letter' have?,fake_sent1,What prerequisite does 'send a letter' have?,gen,an American flag,familiar,got a stamp,turn right,2
2803,dream-0139-triplet-6,0,Which goal motivates the act/action 'call me'?,fake_sent1,Which goal motivates the act/action 'call me'?,gen,you were coming to our city,Hello?,find me,haft,2
3998,dream-0496-triplet-2,0,What does 'feeling a bit under the weather' cause?,fake_sent1,What does 'feeling a bit under the weather' cause?,gen,don't look very well,haven't been out,been to the doctor,everything alright,1
1129,daily-dialogue-0001-triplet-5,0,What is 'special party make up' the social norm for?,fake_sent1,What is 'special party make up' the social norm for?,gen,lips shine,formal party,have to bring a gift,open presents,1
1759,daily-dialogue-1021-triplet-2,0,Where is 'special local product' located?,fake_sent1,Where is 'special local product' located?,gen,?,buy these tax free,duty-free shop,bottles,2
992,dream-0606-triplet-24,0,What does 'health' cause?,fake_sent1,What does 'health' cause?,gen,do exercise together,offto the gym,it's impossible to get enough people together,look good,3
1881,dream-0034-triplet-1,0,What desire is caused by 'Saturday afternoon'?,fake_sent1,What desire is caused by 'Saturday afternoon'?,gen,washing down the kitchen walls,doing nothing,having lunch with Georgia,All right.,1
4031,dream-0498-triplet-2,0,What property does 'Robin' have?,fake_sent1,What property does 'Robin' have?,gen,cyclists,leave Ottawa at seven o'clock,president of the Martha Bicycle Club,cyclists can do it in four hours,2
4006,dream-0496-triplet-10,0,What does 'Mrs. Wong' desire?,fake_sent1,What does 'Mrs. Wong' desire?,gen,feeling a bit under the weather,haven't been out,pop into the supermarket,eating,2
4147,dream-0012-triplet-1,0,What property does 'flea market' have?,fake_sent1,What property does 'flea market' have?,gen,changes,the goods there have been used before,lucky,good books,1
105,daily-dialogue-1064-triplet-4,0,What does 'car is still in the garage' cause?,fake_sent1,What does 'car is still in the garage' cause?,gen,give me a ride,have an appointment in 20 minutes,get it fixed,bad luck,3
2038,dream-0319-triplet-5,0,What is 'Coke'?,fake_sent1,What is 'Coke'?,gen,a great idea,stayed in the hospital,drinks,Saturday,2
1377,daily-dialogue-0092-triplet-1,0,What is implied by 'I also agree with all his policies'?,fake_sent1,What is implied by 'I also agree with all his policies'?,gen,love my candidate,agree with all his policies,most intelligent,that,2
3722,dream-0867-triplet-5,0,What does 'Disneyland' have?,fake_sent1,What does 'Disneyland' have?,gen,couple of days,enjoy your visit,Tomorrow Land,believe,2
4172,dream-0702-triplet-1,0,What does 'hungry' cause?,fake_sent1,What does 'hungry' cause?,gen,fed up with French fries and hamburgers,don't mind going somewhere for a light meal,some thing to eat,about McDonald's,2
3872,dream-0466-triplet-6,0,What is implied by 'don't take phone orders'?,fake_sent1,What is implied by 'don't take phone orders'?,gen,aren't enough people,avoid this long wait,two more hours before the ticket office closes,it,1
2518,mutual-1205-triplet-2,0,What does 'i have a very important job and i ca n't miss any work' cause?,fake_sent1,What does 'i have a very important job and i ca n't miss any work' cause?,gen,coming down with something,"cold , but i do n't know for sure",i ca n't miss any work,give me something strong,3
1841,dream-0021-triplet-1,0,What does 'haven't written to anyone for months' cause?,fake_sent1,What does 'haven't written to anyone for months' cause?,gen,something worth seeing,do that,call them tomorrow,I've forgotten them,3
1420,daily-dialogue-0113-triplet-2,0,What does 'fresh' cause?,fake_sent1,What does 'fresh' cause?,gen,recommend,ready to order,All right .,special,0
3089,dream-0338-triplet-3,0,What is 'walk there' obstructed by?,fake_sent1,What is 'walk there' obstructed by?,gen,get there in such a short time,late for the film,taxi,can't walk that far,3
134,daily-dialogue-1067-triplet-6,0,What is 'finish it' the social norm for?,fake_sent1,What is 'finish it' the social norm for?,gen,blowing,gargle with saltwater,make you a glass,No,1
2064,mutual-0004-triplet-9,0,What does 'learn at home' cause?,fake_sent1,What does 'learn at home' cause?,gen,increases family time,avoid problems of traditional schools,showed solutions to a nineteenth century math problem,children will not go to school,0
3582,dream-0833-triplet-5,0,What property does 'horror films' have?,fake_sent1,What property does 'horror films' have?,gen,stupid,cinema,mystery film,special effect,0
3241,dream-0375-triplet-3,0,Which goal motivates the act/action 'she often hides in her room'?,fake_sent1,Which goal motivates the act/action 'she often hides in her room'?,gen,upset,worried about my daughter,sends messages to her friends,concerned,2
91,daily-dialogue-1061-triplet-3,0,What desire is caused by 'first day for you to work'?,fake_sent1,What desire is caused by 'first day for you to work'?,gen,require help,keeping all files,ask the caller to leave a message,lot to learn,3
1466,daily-dialogue-0136-triplet-1,0,What is implied by 'It doesn't look like we're on our way to Altadena'?,fake_sent1,What is implied by 'It doesn't look like we're on our way to Altadena'?,gen,we're on our way to Altadena,we know which bus to catch,we on the right bus,it says Temple City .,2
9,daily-dialogue-1004-triplet-3,0,What desire is caused by 'like this jacket'?,fake_sent1,What desire is caused by 'like this jacket'?,gen,try it on,try clothes,jackets,looking for a new jacket,0
400,daily-dialogue-1242-triplet-4,0,Which goal motivates the act/action 'standing here'?,fake_sent1,Which goal motivates the act/action 'standing here'?,gen,reach the park,Why are you standing here in the cold wind,cold weather,waiting for a bus,3
2133,mutual-0027-triplet-4,0,What does 'nervous' cause?,fake_sent1,What does 'nervous' cause?,gen,going to bed,i 'm so nervous,i ca n't fall asleep,up late studying for the math exam,2
1120,mutual-0299-triplet-3,0,When does 'showed me around' happen?,fake_sent1,When does 'showed me around' happen?,gen,chicken,told me all the rules,first day at the summer job,dinner,2
2305,mutual-1034-triplet-1,0,What does 'how long does it take to get there' depend on?,fake_sent1,What does 'how long does it take to get there' depend on?,gen,first time to the city,what time the museum closes,how long does it take,the traffic,3
4221,mutual-0229-triplet-2,0,What does 'louder' cause?,fake_sent1,What does 'louder' cause?,gen,hear myself think,it was that loud,sorry,ca n't even hear myself,3
1709,daily-dialogue-0438-triplet-1,0,What prerequisite does 'ski' have?,fake_sent1,What prerequisite does 'ski' have?,gen,Somebody up there loves me,hoard,skies can't hold out on us forever,snow,3
3547,dream-0827-triplet-4,0,What is implied by 'struck by lightning'?,fake_sent1,What is implied by 'struck by lightning'?,gen,killed,lightning starts thousands of fires,don't take any chances,caught in a thunderstorm,3
1061,mutual-0280-triplet-3,0,What desire is caused by 'visit uncle lee 's family'?,fake_sent1,What desire is caused by 'visit uncle lee 's family'?,gen,flying to visit uncle lee 's family,clothes should i take,cousin susan can pick you up,yes,1
586,dream-0247-triplet-4,0,What is implied by 'he is quite athletic'?,fake_sent1,What is implied by 'he is quite athletic'?,gen,toknow that before we begin looking,get him a tennis racket,gift,he doesn't like chess very much,3
1062,mutual-0280-triplet-4,0,What desire is caused by 'it rains a lot'?,fake_sent1,What desire is caused by 'it rains a lot'?,gen,borrow an umbrella,pack some t-shirts,clothes,borrow,0
1302,daily-dialogue-0069-triplet-3,0,What does 'Are you doing anything tonight' cause?,fake_sent1,What does 'Are you doing anything tonight' cause?,gen,concert,go and listen to it,like western music,Are you doing anything,1
1788,daily-dialogue-1891-triplet-5,0,What does 'They had a deal who lost will buy movie tickets' cause?,fake_sent1,What does 'They had a deal who lost will buy movie tickets' cause?,gen,It looks like you have to buy tickets for us,want a rematch,not going to see an action movie,who lost will buy movie tickets,0
3353,dream-0427-triplet-8,0,What is implied by 'suffered for six month'?,fake_sent1,What is implied by 'suffered for six month'?,gen,won't need to wear the wedding dress again,Dieting is so boring,meat is not allowed in your diet,size,1
1643,daily-dialogue-0323-triplet-3,0,What does 'so quiet' cause?,fake_sent1,What does 'so quiet' cause?,gen,eerie,neighbors don't even seem to exist,silence,we moved,0
3014,dream-0312-triplet-1,0,What is 'look for a bigger house' obstructed by?,fake_sent1,What is 'look for a bigger house' obstructed by?,gen,spent so much money on your vacation,happy vacation,pay for the rent,I don't see how I can afford one,3
2714,dream-0116-triplet-7,0,Where is 'sports center' located?,fake_sent1,Where is 'sports center' located?,gen,watched a basketball match,See you,been to the new sports center,Saturday,0
2395,mutual-1114-triplet-1,0,What is 'prepare for your trip to the beach' obstructed by?,fake_sent1,What is 'prepare for your trip to the beach' obstructed by?,gen,go when the weather is better,weather report is calling for rain this weekend,weekend,work a half day,1
1793,dream-0002-triplet-1,0,What does 'my wife does.' cause?,fake_sent1,What does 'my wife does.' cause?,gen,a lot of them,like them very much,buy some from you,buy some,2
2014,dream-0063-triplet-4,0,What is implied by 'Are the taxis in London all black'?,fake_sent1,What is implied by 'Are the taxis in London all black'?,gen,wait with you,first time in London,know,wait by the roadside,1
3356,dream-0431-triplet-2,0,What does 'my alarm clock that didn't wake me up' cause?,fake_sent1,What does 'my alarm clock that didn't wake me up' cause?,gen,didn't wake me up,rushed to school,late for the following class,late for class within this week,3
2355,mutual-1072-triplet-2,0,What does 'not yet' cause?,fake_sent1,What does 'not yet' cause?,gen,i have n't put any glasses on the table yet,hungry,i 'm hungry,have you had dinner yet,2
2203,mutual-0076-triplet-2,0,What does 'pretty bad accident' cause?,fake_sent1,What does 'pretty bad accident' cause?,gen,car,i 'm lucky,a little frightened,i,2
200,daily-dialogue-1139-triplet-4,0,What property does 'nice apples' have?,fake_sent1,What property does 'nice apples' have?,gen,dollars,Anything,these,Very sweet,3
727,dream-0288-triplet-1,0,What is 'heat' capable of?,fake_sent1,What is 'heat' capable of?,gen,medicine,not become ill from the heat,make anyone ill,vacation,2
583,dream-0247-triplet-1,0,What desire is caused by 'nephew Jim is graduating from college next week'?,fake_sent1,What desire is caused by 'nephew Jim is graduating from college next week'?,gen,get him a tennis racket,like to get him a nice gift,May I help you,price range,1
1197,daily-dialogue-0017-triplet-1,0,What is 'pet lizard' capable of?,fake_sent1,What is 'pet lizard' capable of?,gen,harmless,moved,skin feels really cool,lizard,1
1477,daily-dialogue-0139-triplet-2,0,What does 'don't have any cash with me' cause?,fake_sent1,What does 'don't have any cash with me' cause?,gen,have the check,bring some to-go boxes,accept credit cards and cash,put it on credit,3
2182,mutual-0051-triplet-4,0,What property does 'birthday party' have?,fake_sent1,What property does 'birthday party' have?,gen,birthday party,accepting any late papers,did n't get much sleep,lasted very long,3
3400,dream-0449-triplet-1,0,"What is 'hamburgers, sandwiches'?",fake_sent1,"What is 'hamburgers, sandwiches'?",gen,fast food,convenient,not bad,convenience,0
